<?xml version="1.0" encoding="UTF-8"?>
<mdq:check xmlns:mdq="https://nceas.ucsb.edu/mdqe" xmlns:xsi="http://www.w3.org/2001/XMLSchema-instance" xsi:schemaLocation="https://nceas.ucsb.edu/mdqe /Users/leinfelder/git/mdqengine/src/main/resources/schemas/schema1.xsd">
  <id>contact</id>
  <name>Contact is present</name>
  <level>REQUIRED</level>
  <environment>rscript</environment>  
  <code>
    library(metadig)
    check_presence(contact)
  </code>
  <selector>
    <name>contact</name>
    <xpath>/eml/dataset/contact</xpath>
  </selector>
  <dialect>
    <name>eml</name>
    <xpath>boolean(/*[local-name() = 'eml'])</xpath>
  </dialect>
</mdq:check>
