<?xml version="1.0" encoding="UTF-8"?>
<mdq:check xmlns:mdq="https://nceas.ucsb.edu/mdqe" xmlns:xsi="http://www.w3.org/2001/XMLSchema-instance" xsi:schemaLocation="https://nceas.ucsb.edu/mdqe /Users/leinfelder/git/mdqengine/src/main/resources/schemas/schema1.xsd">
  <id>identifier.is.present</id>
  <name>Identifier is present</name>
  <type>metadata</type>
  <level>REQUIRED</level>
  <environment>rscript</environment>
  <code><![CDATA[
if (length(identifier) > 0) {
mdq_result <- list(status = "SUCCESS",
                   output = list(list(value = "Identifier was present.")))
} else {
mdq_result <- list(status = "FAILURE",
                   output = list(list(value = "Identifier was not present.")))
}
    ]]>
  </code>
  <selector>
    <name>identifier</name>
    <xpath>/eml/@packageId |
      /*/gmd:fileIdentifier/gco:CharacterString</xpath>
  </selector>
</mdq:check>
