<?xml version="1.0" encoding="UTF-8"?>
<mdq:check xmlns:mdq="https://nceas.ucsb.edu/mdqe" xmlns:xsi="http://www.w3.org/2001/XMLSchema-instance" xsi:schemaLocation="https://nceas.ucsb.edu/mdqe /Users/leinfelder/git/mdqengine/src/main/resources/schemas/schema1.xsd">
  <id>temporal.start.year</id>
  <name>Temporal coverage has a start year</name>
  <level>REQUIRED</level>
  <environment>rscript</environment>
  <code><![CDATA[
    library(metadig)
    check_presence(begin_date)
  ]]></code>
  <selector>
    <name>begin_date</name>
    <xpath>/eml/dataset/temporalCoverage/rangeOfDates/beginDate/calendarDate</xpath>
  </selector>
  <dialect>
    <name>eml</name>
    <xpath>boolean(/*[local-name() = 'eml'])</xpath>
  </dialect>
</mdq:check>
