<?xml version="1.0" encoding="UTF-8"?>
<mdq:check xmlns:mdq="https://nceas.ucsb.edu/mdqe" xmlns:xsi="http://www.w3.org/2001/XMLSchema-instance" xsi:schemaLocation="https://nceas.ucsb.edu/mdqe ../schemas/schema1.xsd">
  <id>check.creator.present.1</id>
  <name>Creator</name>
  <description>Creator should be present</description>
  <type>identification</type>
  <level>REQUIRED</level>
  <environment>rscript</environment>
<code><![CDATA[
    library(metadig)

    if (length(creator) <= 0) {
      failure("No creator(s) were found.")
    } else {
      success("One or more creators were found.")
    }
  ]]></code>
  <selector>
    <name>creator</name>
    <xpath>/eml/dataset/creator</xpath>
  </selector>
  <dialect>
    <name>eml</name>
    <xpath>boolean(/*[local-name() = 'eml'])</xpath>
  </dialect>

</mdq:check>
