<?xml version="1.0" encoding="UTF-8"?>
<mdq:suite xmlns:mdq="https://nceas.ucsb.edu/mdqe/v1" xmlns:xsi="http://www.w3.org/2001/XMLSchema-instance" xsi:schemaLocation="https://nceas.ucsb.edu/mdqe/v1 /Users/leinfelder/git/mdqengine/src/main/resources/schemas/schema1.xsd">
	<id>suite.2.1</id>      
	<name>Testing suite</name>
   <check>
      <id>check.1.1</id>      
      <name>Title Length</name>
      <description>Checks that title is longer than 10 characters</description>
      <type>metadata</type>
      <level>OPTIONAL</level>
      <environment>r</environment>
      <code><![CDATA[nchar(title) > 10]]></code>      
      <selector>
         <name>title</name>
         <xpath>//dataset/title</xpath>
      </selector>
   </check>
   <check>
      <id>check.2.1</id>
      <name>Entity Count</name>
      <description>Checks that there are 1 or more data entities in the data package</description>
      <type>data</type>      
      <level>INFO</level>
      <environment>JavaScript</environment>
      <code><![CDATA[entityCount > 0]]></code>
      <selector>
         <name>entityCount</name>
         <xpath>count(//dataset/dataTable | //dataset/otherEntity)</xpath>
      </selector>
   </check>
   <check>
      <id>check.3.1</id>  
      <name>Unique attribute names</name>
      <description>Checks that all attribute names are unique across datapackage</description>
      <level>REQUIRED</level>
      <environment>r</environment>
      <code><![CDATA[any(duplicated(attributeNames))]]></code>
      <selector>
         <name>attributeNames</name>
         <xpath>//attribute/attributeName</xpath>
      </selector>
   </check>
</mdq:suite>