<?xml version="1.0" encoding="UTF-8"?>
<mdq:check xmlns:mdq="https://nceas.ucsb.edu/mdqe" xmlns:xsi="http://www.w3.org/2001/XMLSchema-instance" xsi:schemaLocation="https://nceas.ucsb.edu/mdqe ../schemas/schema1.xsd">
  <id>check.abstract.100.words.1</id>
  <name>Abstract length</name>
  <description>Abstract should be at least 100 words long.</description>
  <type>discovery</type>  
  <level>REQUIRED</level>
  <environment>rscript</environment>
  <code><![CDATA[
    if (length(abstract) == 0) {
      status <- "FAILURE"
      message <- "No abstract sections were found."
    } else if (length(abstract) > 1) {
      status <- "FAILURE"
      message <- "More than one abstract section was found when one was expected."
    } else {
      library(stringr)
      tokens <- str_split(abstract, " ")[[1]]

      if (length(tokens) >= 100) {
        status <- "SUCCESS"
        message <- paste0("The abstract was ", length(tokens), " word(s) long which is sufficient.")
      } else {
        status <- "FAILURE"
        message <- paste0("The abstract was only ", length(tokens), " word(s) long but 100 or more was requried.")
      }
    }

    mdq_result <- list(status = status,
                       output = list(list(value = message)))
  ]]></code>
  <selector>
    <name>abstract</name>
    <xpath>/eml/dataset/abstract</xpath>
  </selector>
  <dialect>
    <name>eml</name>
    <xpath>boolean(/*[local-name() = 'eml'])</xpath>
  </dialect>
</mdq:check>
